{
  "schemaVersion": 1,
  "analysisId": "synthetic-analysis-2026-07-20-001",
  "type": "daily-support-suggestion",
  "summary": "Bugün toparlanma ihtiyacın artmış olabilir.",
  "suggestion": "Akşam planını daha hafif tutmayı ve uyku saatini öne çekmeyi değerlendirebilirsin.",
  "evidence": [
    { "source": "today-core", "eventId": "synthetic-core-2026-07-20-001", "reference": "Zordu bugün" },
    { "source": "today-health", "eventId": "synthetic-health-2026-07-20-001", "reference": "5 saat uyku" }
  ],
  "confidence": 0.79,
  "uncertainty": ["Bugünkü iş yükü bilinmiyor.", "Kullanıcının zorunlu planları bilinmiyor."],
  "alternatives": ["Öneriyi reddet", "Planı kendine göre düzenle", "Bu analizden Health verisini çıkar"],
  "requiresUserApproval": true,
  "proposedActions": [
    { "actionId": "synthetic-action-001", "type": "create-reminder", "label": "Uyku hazırlığı", "status": "pending-user-approval" }
  ]
}

